{
  "mandate_id": "urn:uuid:9c0e2b1a-7d54-4f0e-9a6b-2c8f41d0e7aa",
  "profile": "urn:agent-clearance:profile:origin-scoped-mandate:0.1",
  "issuer": "https://travel.example",
  "audience": "https://travel.example",
  "subject": {
    "kind": "pairwise_principal",
    "id": "urn:uuid:43ff2d65-a302-4b52-9f80-f1f3776d8b71"
  },
  "presenter_key_id": "https://harness.example/keys/k/8f3a1c",
  "actions": [
    {
      "type": "availability.read",
      "resource": "hotel_inventory",
      "constraints": {
        "maximum_results": 100
      }
    }
  ],
  "created_at": "2026-08-31T15:50:00Z",
  "expires_at": "2026-08-31T16:15:00Z",
  "approval": {
    "method": "passkey",
    "displayed": {
      "origin": "https://travel.example",
      "action": "availability.read",
      "resource": "hotel_inventory",
      "expires_at": "2026-08-31T16:15:00Z",
      "presenter_key_id": "https://harness.example/keys/k/8f3a1c"
    }
  },
  "signature": {
    "alg": "ed25519",
    "key_id": "https://travel.example/.well-known/agent-clearance/keys/mandate-issuer",
    "value": "Ny6NFBgPb2RVgMT93ZOpjowZvO3TpZ1R2KZps--MXuTIYAteYB_WlT1aHec7reOid3jtR3J8GWIjdV5KJ5sIDA"
  }
}
